{
  "spec_version": "2.0",
  "asset": {
    "id": "bucket_paintloop",
    "game": "paint_loop",
    "class": "container/bucket",
    "l0_function": "Ёмкость переноски краски: вмещает один цвет, вставляется ртом в ячейку лотка (перевёрнутая поза = рабочий процесс), читается по силуэту и градиенту как «ведро с краской».",
    "notes": "Спека = консенсус §7/§8 ontology/pipeline3d.md: зев 1.0W, купол дна до ~0.56W, ручка в обоих референсных состояниях не видна -> в модели её НЕТ (вымышленные части запрещены). Профиль борта = замеренные узлы KT/KV из tools/bucket_v23.py. | алгебра квадратного bbox рефа 564x564 @elev 54.5 (пилот v2.1); замер §8 H/D=1.09 был с другого кадра — конфликт разрешён в пользу N0-кропа | elevation 28: перезамер эллипса текущего N0-кропа"
  },
  "refs": [
    {
      "name": "upright",
      "path": "/Users/user0/godot-hybrid-casual/assets/ref_clean_upright2.png",
      "pose": "upright",
      "source_crop": "sand_loop shot1, изолированный кроп (N0)"
    },
    {
      "name": "dome",
      "path": "/tmp/ref_dome_v2_1788244974.png",
      "pose": "flipped",
      "source_crop": "sand_loop: ведро вставлено ртом в ячейку, виден купол"
    }
  ],
  "camera": {
    "elevation": 35,
    "azimuth": 90,
    "dist": 2.4,
    "z": 0.45,
    "resolution": 512,
    "calibration": "N1 v3: elevation=35 — компромисс между эллипсом обода (~28) и видимой глубиной полости рефа; dist 2.26 решён по W/img_W; светлый градиент сжат к ободу (в рефе яркий только вал обода)"
  },
  "dimensions": {
    "H": 0.99,
    "R_top": 0.5,
    "H_over_D": 0.99
  },
  "units": [
    {
      "id": "body",
      "role": "ёмкость",
      "requirement": "внешняя форма: дно-купол, выпуклые борта, пухлый обод-вал (форма-язык рефа)",
      "build": {
        "prim": "lathe_path",
        "segments": 48,
        "path": [
          [
            0.0,
            0.0
          ],
          [
            0.05,
            0.3
          ],
          [
            0.12,
            0.56
          ],
          [
            0.24,
            0.73
          ],
          [
            0.4,
            0.83
          ],
          [
            0.58,
            0.89
          ],
          [
            0.72,
            0.925
          ],
          [
            0.83,
            0.95
          ],
          [
            0.89,
            0.97
          ],
          [
            0.915,
            0.99
          ],
          [
            0.93,
            1.0
          ],
          [
            0.94,
            1.0
          ],
          [
            0.945,
            0.985
          ],
          [
            0.93,
            0.95
          ],
          [
            0.9,
            0.93
          ],
          [
            0.88,
            0.92
          ]
        ]
      },
      "provenance": {
        "visible_in_poses": [
          "upright",
          "flipped"
        ],
        "ref": "upright",
        "note": "купольное дно подтверждено позой flipped (§8)"
      }
    },
    {
      "id": "cavity",
      "role": "полость",
      "requirement": "внутренняя поверхность темнее: стенка вниз, долина, курган-дно (виден в прямой позе рефа)",
      "build": {
        "prim": "lathe_path",
        "segments": 48,
        "path": [
          [
            0.88,
            0.92
          ],
          [
            0.8,
            0.905
          ],
          [
            0.7,
            0.895
          ],
          [
            0.58,
            0.885
          ],
          [
            0.5,
            0.85
          ],
          [
            0.44,
            0.78
          ],
          [
            0.42,
            0.66
          ],
          [
            0.435,
            0.5
          ],
          [
            0.47,
            0.32
          ],
          [
            0.52,
            0.14
          ],
          [
            0.545,
            0.0
          ]
        ]
      },
      "provenance": {
        "visible_in_poses": [
          "upright"
        ],
        "ref": "upright",
        "note": "курган = внутренняя сторона купола дна (пересечение рефов §8)"
      }
    }
  ],
  "properties": {
    "body": {
      "hex": "#ED6800",
      "gradient_stops": [
        {
          "pos": 0.0,
          "hex": "#F05600"
        },
        {
          "pos": 0.7,
          "hex": "#ED6800"
        },
        {
          "pos": 0.92,
          "hex": "#FF9D00"
        },
        {
          "pos": 1.0,
          "hex": "#FFA900"
        }
      ],
      "gloss": 0.0,
      "behavior": "flat emission-style, градиент по Z (albedo), view_transform Standard",
      "albedo_gate_de": 23,
      "inner_hex": "#D25500",
      "inner_gradient_stops": [
        {
          "pos": 0.0,
          "hex": "#C24A00"
        },
        {
          "pos": 1.0,
          "hex": "#E87500"
        }
      ]
    },
    "cavity": {
      "hex": "#D25500",
      "gradient_stops": [
        {
          "pos": 0.0,
          "hex": "#C24A00"
        },
        {
          "pos": 0.55,
          "hex": "#D95E00"
        },
        {
          "pos": 1.0,
          "hex": "#F07A00"
        }
      ],
      "gloss": 0.0,
      "behavior": "полость темнее корпуса: стенки глубже по тону, курган светлее к вершине"
    }
  },
  "projections": {
    "front": [
      {
        "unit": "body",
        "x0": -0.87,
        "x1": 0.87,
        "y0": 0.0,
        "y1": 1.0,
        "note": "в долях H; ширина тела в долях W=2*R_top"
      },
      {
        "unit": "mouth_ring",
        "x0": -1.0,
        "x1": 1.0,
        "y0": 0.94,
        "y1": 1.0
      },
      {
        "unit": "cavity",
        "x0": -0.92,
        "x1": 0.92,
        "y0": 0.495,
        "y1": 0.94,
        "note": "полость внутри зева; курган до 0.585H"
      }
    ],
    "top": [
      {
        "unit": "body",
        "x0": -0.87,
        "x1": 0.87,
        "y0": -0.87,
        "y1": 0.87
      },
      {
        "unit": "mouth_ring",
        "x0": -1.0,
        "x1": 1.0,
        "y0": -1.0,
        "y1": 1.0,
        "note": "зев 1.0W — правило §8"
      },
      {
        "unit": "cavity",
        "x0": -0.92,
        "x1": 0.92,
        "y0": 0.495,
        "y1": 0.94,
        "note": "полость внутри зева; курган до 0.585H"
      }
    ],
    "side": [
      {
        "unit": "body",
        "x0": -0.87,
        "x1": 0.87,
        "y0": 0.0,
        "y1": 1.0
      },
      {
        "unit": "mouth_ring",
        "x0": -1.0,
        "x1": 1.0,
        "y0": 0.94,
        "y1": 1.0
      },
      {
        "unit": "cavity",
        "x0": -0.92,
        "x1": 0.92,
        "y0": 0.495,
        "y1": 0.94,
        "note": "полость внутри зева; курган до 0.585H"
      }
    ]
  },
  "poses": [
    {
      "name": "upright",
      "transform": "identity",
      "camera_elevation": 35,
      "camera_dist": 2.26,
      "sink": 0.0,
      "ref": "upright"
    },
    {
      "name": "flipped",
      "transform": "flip_180_x",
      "camera_elevation": 24,
      "camera_dist": 1.6,
      "sink": 0.62,
      "ref": "dome"
    }
  ],
  "budget": {
    "tris_max": 9000,
    "one_mesh": false,
    "texture": "vertex_gradient"
  },
  "style_refs": {
    "style_constants": "style_constants.json",
    "target_style": "soft3d_v2"
  }
}